{
  "$schema": "https://json-schema.org/draft/2020-12/schema",
  "$id": "https://github.com/jmanuelng/WIN_PCinfo/schemas/effective-policy.schema.json",
  "title": "WIN-PCInfo Effective Policy release policy",
  "type": "object",
  "additionalProperties": false,
  "required": [
    "kind",
    "contractVersion",
    "release",
    "policyId",
    "evidenceProfileId",
    "layers",
    "collectors",
    "sourceCatalog",
    "auditSubcategories",
    "userRights",
    "securityOptions",
    "defenderPreferences",
    "smartScreenSignals",
    "firewallProfiles",
    "userRightSemantics",
    "localAccountPolicySemantics",
    "scopes",
    "rules",
    "discoveryTasks",
    "validationScenarios"
  ],
  "properties": {
    "kind": { "const": "win-pcinfo.effective-policy-policy" },
    "contractVersion": { "const": "1.0.0" },
    "release": { "const": "2.0.0-preview.1" },
    "policyId": { "const": "win-pcinfo.effective-policy/1.0.0" },
    "evidenceProfileId": { "const": "profile:device-firmware-identity-administrator-and-policy-readiness" },
    "layers": { "type": "array", "minItems": 3, "maxItems": 3, "items": { "$ref": "#/$defs/layer" } },
    "collectors": { "type": "array", "minItems": 1, "maxItems": 1, "prefixItems": [{ "$ref": "#/$defs/collector" }], "items": false },
    "sourceCatalog": { "type": "array", "minItems": 20, "maxItems": 20, "items": { "$ref": "#/$defs/source" } },
    "auditSubcategories": { "type": "array", "minItems": 3, "maxItems": 3, "items": { "$ref": "#/$defs/catalogPair" } },
    "userRights": { "type": "array", "minItems": 3, "maxItems": 3, "items": { "$ref": "#/$defs/right" } },
    "securityOptions": { "type": "array", "minItems": 3, "maxItems": 3, "items": { "$ref": "#/$defs/registrySignal" } },
    "defenderPreferences": { "type": "array", "minItems": 1, "maxItems": 1, "items": { "$ref": "#/$defs/commandSignal" } },
    "smartScreenSignals": { "type": "array", "minItems": 3, "maxItems": 3, "items": { "$ref": "#/$defs/registrySignal" } },
    "firewallProfiles": { "type": "array", "minItems": 3, "maxItems": 3, "items": { "$ref": "#/$defs/firewallProfile" } },
    "userRightSemantics": { "const": "DirectAssignmentsOnly" },
    "localAccountPolicySemantics": { "const": "LocalSamAccountsOnly" },
    "scopes": { "type": "array", "minItems": 54, "maxItems": 54, "items": { "$ref": "#/$defs/scope" } },
    "rules": { "type": "array", "minItems": 7, "maxItems": 7, "items": { "$ref": "#/$defs/rule" } },
    "discoveryTasks": { "type": "array", "minItems": 2, "maxItems": 2, "items": { "$ref": "#/$defs/discoveryTask" } },
    "validationScenarios": {
      "const": [
        "Workgroup",
        "Domain",
        "UserAndComputerRsop",
        "MissingRsop",
        "StaleRegistry",
        "DeniedAdministrator",
        "DeniedSystem",
        "NonEnglish",
        "AppliedOrderConflict",
        "AccountLockout",
        "AuditPolicy",
        "UserRights",
        "SecurityOptions",
        "PartialChannel",
        "NonMdm",
        "UnsupportedMdmBuild",
        "MissingMdmClass",
        "MissingMdmProperty",
        "MdmPolicyConflict",
        "MdmWinsOverGpScoped",
        "WindowsUpdatePolicy",
        "RemoteManagementCombinations",
        "SmbPosture",
        "LegacyAuthMasks",
        "ThirdPartyRegistration",
        "DefenderDisabled",
        "DefenderUnavailable",
        "AmbiguousSecurityCenter",
        "TamperProtected",
        "MissingDefenderProperty",
        "FirewallProfiles",
        "AsrRulePairs",
        "BitLockerEncrypted",
        "BitLockerUnencrypted",
        "BitLockerUnknown",
        "VbsCredentialGuardRunning",
        "VbsConfiguredNotRunning",
        "WdacWindows11Policies",
        "WdacWindows10Unsupported",
        "AppLockerGpOnly",
        "AppLockerCspOnly",
        "AppLockerGpCspConflict",
        "AppLockerChannelIncomplete",
        "VirtualMachineSecurity"
      ]
    }
  },
  "$defs": {
    "layer": {
      "type": "object",
      "additionalProperties": false,
      "required": ["layerId", "purpose", "scopeIds"],
      "properties": {
        "layerId": { "enum": ["AppliedPolicyEvidence", "ConfiguredPolicySignals", "CurrentControlState"] },
        "purpose": { "type": "string", "minLength": 20, "maxLength": 512 },
        "scopeIds": { "type": "array", "minItems": 3, "maxItems": 24, "uniqueItems": true, "items": { "type": "string", "pattern": "^scope:policy\\." } }
      }
    },
    "collector": {
      "type": "object",
      "additionalProperties": false,
      "required": [
        "collectorId",
        "collectorVersion",
        "operationId",
        "source",
        "executionContext",
        "privilege",
        "networkBehavior",
        "executable",
        "dependencies",
        "mayPrompt",
        "mayInstall",
        "mayDownload",
        "maySelfElevate",
        "writesAllowed",
        "maximumAttempts",
        "deadlineMilliseconds",
        "resultMaximumUtf8Bytes",
        "maximumAppliedPoliciesPerTarget",
        "maximumPolicySettingsPerTarget",
        "maximumPrincipalsPerRight",
        "maximumSecurityProvidersPerCategory",
        "maximumAsrRules",
        "cleanup"
      ],
      "properties": {
        "collectorId": { "const": "collector:windows.effective-policy" },
        "collectorVersion": { "const": "1.0.0" },
        "operationId": { "const": "observe-effective-policy" },
        "source": { "const": "Release-owned projection of cached RSoP WMI, local NetAPI, Audit Policy, LSA Policy, Windows Security Center, approved Defender cmdlets, ActiveStore firewall state, BitLocker status, Win32_DeviceGuard state, structured WDAC inventory, separate AppLocker GP and CSP channels, and exact local registry values" },
        "executionContext": { "const": "Administrator" },
        "privilege": { "const": "RequiresAdministrator" },
        "networkBehavior": { "const": "OfflineOnly" },
        "executable": { "const": "ActiveMicrosoftSignedPowerShellHost" },
        "dependencies": {
          "const": [
            "Windows RSoP WMI provider",
            "Netapi32.dll",
            "Advapi32.dll",
            "Wscapi.dll",
            "Defender PowerShell module",
            "NetSecurity PowerShell module",
            "Microsoft.WSMan.Management PowerShell module",
            "SmbShare PowerShell module",
            "DISM PowerShell module",
            "BitLocker PowerShell module",
            "AppLocker PowerShell module",
            "CiTool.exe",
            "Microsoft.Win32.Registry"
          ]
        },
        "mayPrompt": { "const": false },
        "mayInstall": { "const": false },
        "mayDownload": { "const": false },
        "maySelfElevate": { "const": false },
        "writesAllowed": { "const": false },
        "maximumAttempts": { "const": 1 },
        "deadlineMilliseconds": { "const": 5000 },
        "resultMaximumUtf8Bytes": { "const": 16384 },
        "maximumAppliedPoliciesPerTarget": { "const": 8 },
        "maximumPolicySettingsPerTarget": { "const": 8 },
        "maximumPrincipalsPerRight": { "const": 8 },
        "maximumSecurityProvidersPerCategory": { "const": 4 },
        "maximumAsrRules": { "const": 16 },
        "cleanup": { "const": "CoordinatorOwnedJobObjectAndWorkerVerifiedAbsent" }
      }
    },
    "source": {
      "type": "object",
      "additionalProperties": false,
      "required": ["sourceId", "interface", "limitation"],
      "properties": {
        "sourceId": { "type": "string", "pattern": "^source:windows\\." },
        "interface": { "type": "string", "minLength": 8, "maxLength": 192 },
        "namespaces": { "type": "array", "minItems": 2, "maxItems": 2, "items": { "type": "string" } },
        "classes": { "type": "array", "minItems": 3, "maxItems": 4, "items": { "type": "string" } },
        "supportedSettingClasses": { "const": ["RSOP_RegistryPolicySetting"] },
        "approvedProperties": { "type": "array", "minItems": 1, "maxItems": 16, "uniqueItems": true, "items": { "type": "string" } },
        "limitation": { "type": "string", "minLength": 12, "maxLength": 128 }
      }
    },
    "catalogPair": {
      "type": "object",
      "additionalProperties": false,
      "required": ["catalogId", "guid"],
      "properties": {
        "catalogId": { "type": "string", "pattern": "^audit:" },
        "guid": { "type": "string", "pattern": "^[0-9a-f]{8}-[0-9a-f]{4}-[0-9a-f]{4}-[0-9a-f]{4}-[0-9a-f]{12}$" }
      }
    },
    "right": {
      "type": "object",
      "additionalProperties": false,
      "required": ["catalogId", "nativeName"],
      "properties": {
        "catalogId": { "type": "string", "pattern": "^right:" },
        "nativeName": { "type": "string", "pattern": "^Se[A-Za-z]+Right$" }
      }
    },
    "registrySignal": {
      "type": "object",
      "additionalProperties": false,
      "required": ["catalogId", "registryPath", "valueName", "valueType", "fieldId"],
      "properties": {
        "catalogId": { "type": "string", "minLength": 1, "maxLength": 96 },
        "registryPath": { "type": "string", "minLength": 8, "maxLength": 256 },
        "valueName": { "type": "string", "minLength": 1, "maxLength": 64 },
        "valueType": { "enum": ["Boolean", "Integer"] },
        "fieldId": { "type": "string", "pattern": "^field:policy\\." }
      }
    },
    "commandSignal": {
      "type": "object",
      "additionalProperties": false,
      "required": ["catalogId", "commandProperty", "valueType", "fieldId"],
      "properties": {
        "catalogId": { "type": "string", "pattern": "^defender-preference:" },
        "commandProperty": { "type": "string", "minLength": 1, "maxLength": 64 },
        "valueType": { "const": "String" },
        "fieldId": { "type": "string", "pattern": "^field:policy\\.defender\\." }
      }
    },
    "firewallProfile": {
      "type": "object",
      "additionalProperties": false,
      "required": ["catalogId", "profileName", "scopeId"],
      "properties": {
        "catalogId": { "type": "string", "pattern": "^firewall-profile:" },
        "profileName": { "enum": ["Domain", "Private", "Public"] },
        "scopeId": { "type": "string", "pattern": "^scope:policy\\.firewall\\." }
      }
    },
    "scope": {
      "type": "object",
      "additionalProperties": false,
      "required": ["scopeId", "fieldIds"],
      "properties": {
        "scopeId": { "type": "string", "pattern": "^scope:policy\\." },
        "fieldIds": { "type": "array", "minItems": 1, "maxItems": 5, "uniqueItems": true, "items": { "type": "string", "pattern": "^field:policy\\." } }
      }
    },
    "discoveryTask": {
      "type": "object",
      "additionalProperties": false,
      "required": ["definitionId", "kind", "title", "recommendedAudience"],
      "properties": {
        "definitionId": { "type": "string", "pattern": "^task:confirm-[a-z0-9-]+/1\\.0\\.0$" },
        "kind": { "const": "TenantSideDiscoveryTask" },
        "title": { "type": "string", "minLength": 20, "maxLength": 256 },
        "recommendedAudience": { "const": "AuthorizedTenantPolicyAdministrator" }
      }
    },
    "rule": {
      "type": "object",
      "additionalProperties": false,
      "required": [
        "findingKind",
        "ruleId",
        "operationId",
        "source",
        "executionContext",
        "privilege",
        "networkBehavior",
        "executable",
        "dependencies",
        "mayPrompt",
        "mayInstall",
        "mayDownload",
        "maySelfElevate",
        "writesAllowed",
        "maximumAttempts",
        "deadlineMilliseconds",
        "maximumInputObservations",
        "maximumOutputFindings",
        "cleanup",
        "missingEvidenceOutcome"
      ],
      "properties": {
        "findingKind": { "type": "string", "pattern": "^[a-z0-9-]+$" },
        "ruleId": { "type": "string", "pattern": "^rule:policy\\." },
        "operationId": { "type": "string", "pattern": "^op:rule\\.policy\\." },
        "source": { "const": "ReleaseEmbeddedValidatedObservationRule" },
        "executionContext": { "const": "InProcessValidatedAssessmentRecord" },
        "privilege": { "const": "NoElevation" },
        "networkBehavior": { "const": "OfflineOnly" },
        "executable": { "const": "NoneInProcess" },
        "dependencies": { "const": [] },
        "mayPrompt": { "const": false },
        "mayInstall": { "const": false },
        "mayDownload": { "const": false },
        "maySelfElevate": { "const": false },
        "writesAllowed": { "const": false },
        "maximumAttempts": { "const": 1 },
        "deadlineMilliseconds": { "const": 100 },
        "maximumInputObservations": { "type": "integer", "minimum": 1, "maximum": 128 },
        "maximumOutputFindings": { "const": 1 },
        "cleanup": { "const": "NoArtifacts" },
        "missingEvidenceOutcome": { "const": "Indeterminate" }
      }
    }
  }
}
