{
  "kind": "win-pcinfo.effective-policy-policy",
  "contractVersion": "1.0.0",
  "release": "2.0.0-preview.1",
  "policyId": "win-pcinfo.effective-policy/1.0.0",
  "evidenceProfileId": "profile:device-firmware-identity-administrator-and-policy-readiness",
  "layers": [
    {
      "layerId": "AppliedPolicyEvidence",
      "purpose": "Locally cached RSoP identity, applicability, link, and precedence reported for the assessed device and Assessment User Context.",
      "scopeIds": [
        "scope:policy.applied.user.identity",
        "scope:policy.applied.user.applicability",
        "scope:policy.applied.user.link",
        "scope:policy.applied.user.precedence",
        "scope:policy.applied.computer.identity",
        "scope:policy.applied.computer.applicability",
        "scope:policy.applied.computer.link",
        "scope:policy.applied.computer.precedence"
      ]
    },
    {
      "layerId": "ConfiguredPolicySignals",
      "purpose": "Release-cataloged local registry values and Defender preferences that may be policy-backed but do not prove tenant intent, winning channel, or current enforcement.",
      "scopeIds": [
        "scope:policy.rdp.connections",
        "scope:policy.rdp.authentication",
        "scope:policy.rdp.listener",
        "scope:policy.winrm.configuration",
        "scope:policy.winrm.authentication",
        "scope:policy.smb.client",
        "scope:policy.smb.server",
        "scope:policy.security-option.machine-inactivity-limit",
        "scope:policy.security-option.disable-cad",
        "scope:policy.security-option.lm-compatibility-level",
        "scope:policy.windows-update.defer-feature-updates",
        "scope:policy.windows-update.defer-quality-updates",
        "scope:policy.windows-update.disable-dual-scan",
        "scope:policy.legacy-auth.lm-compatibility-level",
        "scope:policy.legacy-auth.ntlm-minimum-session-security",
        "scope:policy.defender.asr",
        "scope:policy.defender.network-protection",
        "scope:policy.smartscreen.shell",
        "scope:policy.smartscreen.app-install-control",
        "scope:policy.wdac.inventory",
        "scope:policy.applocker.gp-channel",
        "scope:policy.applocker.csp-channel"
      ]
    },
    {
      "layerId": "CurrentControlState",
      "purpose": "Current local SAM, audit-policy, direct user-right, Windows Security Center, Defender runtime, ActiveStore firewall, BitLocker, and device-reported VBS state reported by Windows at assessment time.",
      "scopeIds": [
        "scope:policy.local-sam.password",
        "scope:policy.local-sam.lockout",
        "scope:policy.local-audit",
        "scope:policy.local-user-rights",
        "scope:policy.security-center.antivirus-providers",
        "scope:policy.security-center.firewall-providers",
        "scope:policy.defender.runtime",
        "scope:policy.firewall.domain-profile",
        "scope:policy.firewall.private-profile",
        "scope:policy.firewall.public-profile",
        "scope:policy.rdp.service",
        "scope:policy.winrm.service",
        "scope:policy.winrm.listener",
        "scope:policy.smb.smb1-feature",
        "scope:policy.bitlocker.operating-system-volume",
        "scope:policy.bitlocker.protectors",
        "scope:policy.vbs.runtime"
      ]
    }
  ],
  "collectors": [
    {
      "collectorId": "collector:windows.effective-policy",
      "collectorVersion": "1.0.0",
      "operationId": "observe-effective-policy",
      "source": "Release-owned projection of cached RSoP WMI, local NetAPI, Audit Policy, LSA Policy, Windows Security Center, approved Defender cmdlets, ActiveStore firewall state, BitLocker status, Win32_DeviceGuard state, structured WDAC inventory, separate AppLocker GP and CSP channels, and exact local registry values",
      "executionContext": "Administrator",
      "privilege": "RequiresAdministrator",
      "networkBehavior": "OfflineOnly",
      "executable": "ActiveMicrosoftSignedPowerShellHost",
      "dependencies": [
        "Windows RSoP WMI provider",
        "Netapi32.dll",
        "Advapi32.dll",
        "Wscapi.dll",
        "Defender PowerShell module",
        "NetSecurity PowerShell module",
        "Microsoft.WSMan.Management PowerShell module",
        "SmbShare PowerShell module",
        "DISM PowerShell module",
        "BitLocker PowerShell module",
        "AppLocker PowerShell module",
        "CiTool.exe",
        "Microsoft.Win32.Registry"
      ],
      "mayPrompt": false,
      "mayInstall": false,
      "mayDownload": false,
      "maySelfElevate": false,
      "writesAllowed": false,
      "maximumAttempts": 1,
      "deadlineMilliseconds": 5000,
      "resultMaximumUtf8Bytes": 16384,
      "maximumAppliedPoliciesPerTarget": 8,
      "maximumPolicySettingsPerTarget": 8,
      "maximumPrincipalsPerRight": 8,
      "maximumSecurityProvidersPerCategory": 4,
      "maximumAsrRules": 16,
      "cleanup": "CoordinatorOwnedJobObjectAndWorkerVerifiedAbsent"
    }
  ],
  "sourceCatalog": [
    {
      "sourceId": "source:windows.rsop.logging-mode",
      "interface": "CimInstancesInCachedRsopNamespaces",
      "namespaces": ["root\\RSOP\\User\\{AssessmentUserSid}", "root\\RSOP\\Computer"],
      "classes": ["RSOP_GPO", "RSOP_GPLink", "RSOP_PolicySetting", "RSOP_RegistryPolicySetting"],
      "supportedSettingClasses": ["RSOP_RegistryPolicySetting"],
      "approvedProperties": ["__CLASS", "guidName", "id", "enabled", "accessDenied", "filterAllowed", "GPO", "SOM", "appliedOrder", "GPOID", "SOMID", "precedence"],
      "limitation": "LoggingModeOnlyAssessmentUserSidBoundNoRefreshNoUnappliedInventoryNoPresentationText"
    },
    {
      "sourceId": "source:windows.local-sam-policy",
      "interface": "NetUserModalsGet(NULL,0|3)",
      "limitation": "LocalSamAccountsOnly"
    },
    {
      "sourceId": "source:windows.system-audit-policy",
      "interface": "AuditQuerySystemPolicy",
      "limitation": "ReleaseCatalogedSubcategoriesOnly"
    },
    {
      "sourceId": "source:windows.lsa-user-rights",
      "interface": "LsaEnumerateAccountsWithUserRight",
      "limitation": "DirectAssignmentsOnlyNoGroupExpansion"
    },
    {
      "sourceId": "source:windows.local-configured-signals",
      "interface": "Microsoft.Win32.Registry.LocalMachine.OpenSubKeyReadOnly",
      "limitation": "ConfiguredSignalOnlySourceEnforcementAndFreshnessUnproven"
    },
    {
      "sourceId": "source:windows.update-policy-registry",
      "interface": "Microsoft.Win32.Registry.LocalMachine.OpenSubKeyReadOnly",
      "limitation": "DocumentedRegistryMappingsOnlyNoUpdateScanNoIntentInference"
    },
    {
      "sourceId": "source:windows.legacy-authentication-registry",
      "interface": "Microsoft.Win32.Registry.LocalMachine.OpenSubKeyReadOnly",
      "limitation": "FiniteRegistryNamesAndMasksOnlyNoProtocolUseInference"
    },
    {
      "sourceId": "source:windows.security-center.providers",
      "interface": "IWSCProductList,IWscProduct,WscGetSecurityProviderHealth",
      "limitation": "AntivirusAndFirewallProvidersOnlyNoTrustOrRemediationClaims"
    },
    {
      "sourceId": "source:windows.defender.runtime-status",
      "interface": "Get-MpComputerStatus",
      "limitation": "DefenderRuntimeOnlyNoPreferenceIntentNoExclusionProjection"
    },
    {
      "sourceId": "source:windows.defender.preferences",
      "interface": "Get-MpPreference",
      "limitation": "ReleaseCatalogedPreferenceFieldsOnlyNoExclusionProjectionNoMutation"
    },
    {
      "sourceId": "source:windows.firewall.activestore-profiles",
      "interface": "Get-NetFirewallProfile -PolicyStore ActiveStore",
      "limitation": "DomainPrivatePublicProfilesOnlyNoRuleEnumeration"
    },
    {
      "sourceId": "source:windows.rdp.configuration",
      "interface": "Get-CimInstance Win32_Service,Get-CimInstance Win32_TSGeneralSetting,Microsoft.Win32.Registry.LocalMachine.OpenSubKeyReadOnly",
      "limitation": "LocalConfigurationAndServiceOnlyNoReachability"
    },
    {
      "sourceId": "source:windows.winrm.configuration",
      "interface": "Win32_Service; HKLM Service policy registry: AllowUnencryptedTraffic,AllowBasic,AllowKerberos,AllowNegotiate,AllowCredSSP",
      "limitation": "LocalConfigurationAndServiceOnlyNoReachability"
    },
    {
      "sourceId": "source:windows.smb.configuration",
      "interface": "Get-SmbClientConfiguration,Get-SmbServerConfiguration,Get-WindowsOptionalFeature -Online -FeatureName SMB1Protocol",
      "limitation": "ClientServerAndSmb1FeatureStateOnlyNoShareOrSessionEnumeration"
    },
    {
      "sourceId": "source:windows.mdm-policy-csp-results",
      "interface": "PredefinedLocalSystemMdmBridgePolicyResultCatalog",
      "limitation": "VersionedBuildCatalogPolicyCspOnlyNoDynamicClassDumpNoTenantIntent"
    },
    {
      "sourceId": "source:windows.bitlocker.volume-status",
      "interface": "Win32_EncryptableVolume read-only status methods and type-filtered protector counts",
      "limitation": "OperatingSystemVolumeOnlyNoRecoveryMaterialNoProtectorIdentifiersNoEscrowClaim"
    },
    {
      "sourceId": "source:windows.device-guard.status",
      "interface": "Get-CimInstance Win32_DeviceGuard",
      "limitation": "StructuredRuntimeStateOnlyNoPolicyProvenance"
    },
    {
      "sourceId": "source:windows.app-control.citool",
      "interface": "CiTool -lp -json",
      "limitation": "Windows11_22H2OrLaterStructuredInventoryOnlyNoLegacyTextParsing"
    },
    {
      "sourceId": "source:windows.applocker.gp-effective-policy",
      "interface": "Get-AppLockerPolicy -Effective",
      "limitation": "GroupPolicyOnlyNoCspInferenceNoRuleXmlPublication"
    },
    {
      "sourceId": "source:windows.applocker.csp-policy",
      "interface": "LocalSystem finite AppLocker WMI Bridge EnforcementMode catalog",
      "limitation": "DevicePartitionCspOnlyNoGpInferenceNoRuleXmlPublication"
    }
  ],
  "auditSubcategories": [